{"schema_version":"catalog.agentmuru.dev/v1","revision":"2026-08-17.1","max_artifact_bytes":734003200,"artifacts":[{"id":"qwen-0.5b-q4","model_id":"Qwen/Qwen2.5-0.5B-Instruct-GGUF","revision":"sha256:0123456789abcdef","format":"gguf","url":"https://models.example/qwen.gguf","size_bytes":524288000,"sha256":"aaaaaaaaaaaaaaaaaaaaaaaaaaaaaaaaaaaaaaaaaaaaaaaaaaaaaaaaaaaaaaaa","runtime_variants":["windows-x64-avx"],"minimum_memory_bytes":6442450944,"license":{"id":"apache-2.0","gated":true,"license_url":"https://models.example/license"}}]}
